{
  "adapter_id": "CHATGPT_EXTERNAL_HANDOFF",
  "authority": "START_EVIDENCE_ONLY",
  "authorization_digest": "bbbbbbbbbbbbbbbbbbbbbbbbbbbbbbbbbbbbbbbbbbbbbbbbbbbbbbbbbbbbbbbb",
  "authorization_id": "handoff-auth-example",
  "branch": "feat/example-one",
  "claim_digest": "2baebe99811996a57c46e920260273f8bb53673ce7b3482e8e78e6f412b2e153",
  "claim_id": "claim-example-1",
  "completion_authority": "NONE",
  "effect_id": "claim-source-effect",
  "effect_receipt_digest": "cccccccccccccccccccccccccccccccccccccccccccccccccccccccccccccccc",
  "handoff_digest": "aaaaaaaaaaaaaaaaaaaaaaaaaaaaaaaaaaaaaaaaaaaaaaaaaaaaaaaaaaaaaaaa",
  "head": "1111111111111111111111111111111111111111",
  "implementer": "CHATGPT_CHAT",
  "issue_number": 201,
  "kind": "concurrency_handoff_claim_receipt",
  "node_id": "datarelay-labs/datarelay-atlas#201",
  "pass_authority": "NONE",
  "provider": "openai",
  "release_authority": "NONE",
  "replay_key": "dddddddddddddddddddddddddddddddddddddddddddddddddddddddddddddddd",
  "repository": "datarelay-labs/datarelay-atlas",
  "result": "CLAIMED",
  "route_id": "chat-primary",
  "runtime": "chat_ssh",
  "schema_version": 1,
  "slot_evidence_ref": "capacity:chat-worker-1:001",
  "slot_id": "slot-chat-1",
  "spawned": false,
  "worker_id": "chat-worker-1",
  "workstream": "concurrency-node-1",
  "worktree_identity_digest": "eeeeeeeeeeeeeeeeeeeeeeeeeeeeeeeeeeeeeeeeeeeeeeeeeeeeeeeeeeeeeeee",
  "worktree_path": "/srv/datarelay-atlas-worktrees/example-one"
}
